{
  "$schema": "../../chain.schema.json",
  "chainName": "iopntestnet",
  "website": "https://iopn.tech/",
  "networkType": "testnet",
  "chainType": "cosmos",
  "prettyName": "Iopn",
  "chainId": "iopn_984-1",
  "bech32Prefix": "gwei",
  "keyAlgos": [
    "secp256k1"
  ],
  "slip44": 118,
  "fees": {
    "feeTokens": [
      {
        "denom": "gwei",
        "fixedMinGasPrice": 0,
        "lowGasPrice": 0,
        "averageGasPrice": 0.025,
        "highGasPrice": 0.04
      }
    ]
  },
  "staking": {
    "stakingTokens": [
      {
        "denom": "gwei"
      }
    ],
    "lockDuration": {
      "time": "1209600s"
    }
  },
  "codebase": {
    "sdk": {
      "type": "cosmos",
      "version": "0.47.5"
    }
  },
  "images": [
    {
      "png": "https://raw.githubusercontent.com/cosmos/chain-registry/master/testnets/iopntestnet/images/iopn_Dark.png"
    }
  ],
  "apis": {
    "rpc": [
      {
        "address": "https://testnet-rpc.iopn.tech/"
      }
    ],
    "rest": [
      {
        "address": "https://testnet-rpc2.iopn.tech/"
      }
    ]
  },
  "explorers": [
    {
      "kind": "explorer",
      "url": "https://testnet.iopn.tech/"
    }
  ]
}