{
  "$schema": "../../chain.schema.json",
  "chainName": "deardogetestnet",
  "chainType": "cosmos",
  "chainId": "deardoge-testnet",
  "prettyName": "Dear Doge Testnet",
  "networkType": "testnet",
  "bech32Prefix": "deardoge",
  "keyAlgos": [
    "secp256k1"
  ],
  "slip44": 118,
  "fees": {
    "feeTokens": [
      {
        "denom": "udear",
        "fixedMinGasPrice": 0.25
      }
    ]
  },
  "staking": {
    "stakingTokens": [
      {
        "denom": "udear"
      }
    ]
  },
  "codebase": {

  },
  "apis": {
    "rpc": [
      {
        "address": "https://testnet-rpc.deardoge.org"
      }
    ],
    "rest": [
      {
        "address": "https://testnet-rest.deardoge.org"
      }
    ],
    "grpc": [
      {
        "address": "testnet-grpc.deardoge.org:443"
      }
    ]
  },
  "explorers": [
    {
      "kind": "Dear Doge Ping Pub",
      "url": "https://testnet-explorer.deardoge.org/deardoge",
      "txPage": "https://testnet-explorer.deardoge.org/deardoge/tx/${txHash}"
    }
  ]
}