{
  "$schema": "../../chain.schema.json",
  "chainName": "kyvedevnet",
  "chainType": "cosmos",
  "chainId": "korellia-2",
  "prettyName": "KYVE Korellia",
  "networkType": "devnet",
  "bech32Prefix": "kyve",
  "keyAlgos": [
    "secp256k1"
  ],
  "slip44": 118,
  "fees": {
    "feeTokens": [
      {
        "denom": "tkyve",
        "fixedMinGasPrice": 0
      }
    ]
  },
  "codebase": {

  },
  "apis": {
    "rpc": [
      {
        "address": "https://rpc.korellia.kyve.network"
      }
    ],
    "rest": [
      {
        "address": "https://api.korellia.kyve.network"
      }
    ]
  },
  "explorers": [
    {
      "kind": "KYVE Explorer",
      "url": "https://explorer.kyve.network/korellia",
      "txPage": "https://explorer.kyve.network/korellia/tx/${txHash}",
      "accountPage": "https://explorer.kyve.network/korellia/account/${accountAddress}"
    }
  ]
}