{
  "$schema": "../chain.schema.json",
  "chainName": "persistence",
  "chainType": "cosmos",
  "chainId": "core-1",
  "prettyName": "Persistence",
  "networkType": "mainnet",
  "website": "https://persistence.one/",
  "bech32Prefix": "persistence",
  "keyAlgos": [
    "secp256k1"
  ],
  "slip44": 118,
  "fees": {
    "feeTokens": [
      {
        "denom": "uxprt",
        "fixedMinGasPrice": 0,
        "lowGasPrice": 0,
        "averageGasPrice": 0.025,
        "highGasPrice": 0.04
      }
    ]
  },
  "staking": {
    "stakingTokens": [
      {
        "denom": "uxprt"
      }
    ],
    "lockDuration": {
      "time": "1814400s"
    }
  },
  "codebase": {
    "sdk": {
      "type": "cosmos",
      "repo": "https://github.com/cosmos/cosmos-sdk",
      "version": "v0.53.4",
      "tag": "v0.53.4"
    },
    "cosmwasm": {
      "version": "v0.60.2",
      "path": "$HOME/.persistenceCore/wasm",
      "enabled": true
    }
  },
  "description": "Persistence is an app chain for Liquid Staking powering an ecosystem of DeFi applications focused on unlocking the liquidity of staked assets.",
  "apis": {
    "rpc": [
      {
        "address": "https://rpc.core.persistence.one"
      },
      {
        "address": "https://persistence.rpc.m.stavr.tech"
      },
      {
        "address": "https://persistence-rpc.kleomedes.network"
      },
      {
        "address": "https://rpc-persistence.architectnodes.com"
      },
      {
        "address": "https://persistence-mainnet-rpc.cosmonautstakes.com"
      },
      {
        "address": "https://persistence.rpc.quantnode.xyz"
      },
      {
        "address": "https://persistence-rpc.zenscape.one"
      },
      {
        "address": "https://persistence-mainnet-rpc.autostake.com:443"
      },
      {
        "address": "https://persistence-rpc.stakeandrelax.net"
      },
      {
        "address": "https://rpc.persistence.posthuman.digital:443"
      },
      {
        "address": "https://rpc-persistence-01.stakeflow.io"
      },
      {
        "address": "https://persistence-rpc.publicnode.com:443"
      },
      {
        "address": "https://persistence-rpc.highstakes.ch"
      },
      {
        "address": "https://persistence-rpc.stakeandrelax.net"
      },
      {
        "address": "https://rpc.persistence.validatus.com"
      },
      {
        "address": "https://public.stakewolle.com/cosmos/persistence/rpc"
      },
      {
        "address": "https://xprt-rpc.antrixy.org/"
      },
      {
        "address": "https://persistence-rpc.stake-town.com"
      },
      {
        "address": "https://persistence.api.pocket.network"
      },
      {
        "address": "https://persistence-rpc.polkachu.com:443"
      }
    ],
    "rest": [
      {
        "address": "https://rest.core.persistence.one"
      },
      {
        "address": "https://persistence.api.m.stavr.tech"
      },
      {
        "address": "https://persistence-api.polkachu.com"
      },
      {
        "address": "https://persistence-api.kleomedes.network"
      },
      {
        "address": "https://rest-persistence.architectnodes.com"
      },
      {
        "address": "https://persistence-mainnet-lcd.autostake.com:443"
      },
      {
        "address": "https://persistence-mainnet-rest.cosmonautstakes.com"
      },
      {
        "address": "https://persistence.lcd.quantnode.xyz"
      },
      {
        "address": "https://persistence-rest.zenscape.one"
      },
      {
        "address": "https://persistence-api.stakeandrelax.net"
      },
      {
        "address": "https://rest.persistence.posthuman.digital:443"
      },
      {
        "address": "https://api-persistence-01.stakeflow.io"
      },
      {
        "address": "https://persistence-rest.publicnode.com"
      },
      {
        "address": "https://persistence-api.highstakes.ch"
      },
      {
        "address": "https://persistence-api.stakeandrelax.net"
      },
      {
        "address": "https://api.persistence.validatus.com"
      },
      {
        "address": "https://public.stakewolle.com/cosmos/persistence/rest"
      },
      {
        "address": "https://xprt-rest.antrixy.org/"
      },
      {
        "address": "https://persistence-api.stake-town.com"
      },
      {
        "address": "https://persistence.api.pocket.network"
      }
    ],
    "grpc": [
      {
        "address": "grpc.core.persistence.one:443"
      },
      {
        "address": "persistence.grpc.m.stavr.tech:410"
      },
      {
        "address": "persistence-grpc.polkachu.com:15490"
      },
      {
        "address": "persistence-mainnet-grpc.autostake.com:443"
      },
      {
        "address": "grpc.persistence.posthuman.digital:80"
      },
      {
        "address": "141.95.33.97:9090"
      },
      {
        "address": "grpc-persistence-01.stakeflow.io:49090"
      },
      {
        "address": "persistence-grpc.w3coins.io:15490"
      },
      {
        "address": "persistence-grpc.publicnode.com:443"
      },
      {
        "address": "persistence-grpc.stakeandrelax.net:15490"
      },
      {
        "address": "grpc.persistence.validatus.com:443"
      },
      {
        "address": "https://xprt-grpc.antrixy.org/"
      },
      {
        "address": "persistence-grpc.stake-town.com:443"
      },
      {
        "address": "persistence.grpc.quantnode.xyz:22990"
      },
      {
        "address": "https://persistence-grpc.highstakes.ch"
      }
    ]
  },
  "explorers": [
    {
      "kind": "mintscan",
      "url": "https://www.mintscan.io/persistence",
      "txPage": "https://www.mintscan.io/persistence/transactions/${txHash}",
      "accountPage": "https://www.mintscan.io/persistence/accounts/${accountAddress}"
    },
    {
      "kind": "ezstaking",
      "url": "https://ezstaking.app/persistence",
      "txPage": "https://ezstaking.app/persistence/txs/${txHash}",
      "accountPage": "https://ezstaking.app/persistence/account/${accountAddress}"
    },
    {
      "kind": "ping.pub",
      "url": "https://ping.pub/persistence",
      "txPage": "https://ping.pub/persistence/tx/${txHash}"
    },
    {
      "kind": "🔥STAVR🔥",
      "url": "https://explorer.stavr.tech/Persistence-Mainnet",
      "txPage": "https://explorer.stavr.tech/Persistence-Mainnet/tx/${txHash}"
    },
    {
      "kind": "staking-explorer.com",
      "url": "https://staking-explorer.com/explorer/persistence",
      "txPage": "https://staking-explorer.com/transaction.php?chain=persistence&tx=${txHash}",
      "accountPage": "https://staking-explorer.com/account.php?chain=persistence&addr=${accountAddress}"
    },
    {
      "kind": "atomscan",
      "url": "https://atomscan.com/persistence",
      "txPage": "https://atomscan.com/persistence/transactions/${txHash}",
      "accountPage": "https://atomscan.com/persistence/accounts/${accountAddress}"
    },
    {
      "kind": "Stakeflow",
      "url": "https://stakeflow.io/persistence",
      "accountPage": "https://stakeflow.io/persistence/accounts/${accountAddress}"
    },
    {
      "kind": "Valopers",
      "url": "https://persistence.valopers.com/",
      "txPage": "https://persistence.valopers.com/transactions/${txHash}",
      "accountPage": "https://persistence.valopers.com/account/${accountAddress}"
    },
    {
      "kind": "moon-runners",
      "url": "https://moon-runners.net/persistence/mainnet",
      "txPage": "https://moon-runners.net/persistence/mainnet/finder?search=${txHash}",
      "accountPage": "https://moon-runners.net/persistence/mainnet/finder?search=${accountAddress}"
    }
  ],
  "images": [
    {
      "png": "https://raw.githubusercontent.com/cosmos/chain-registry/master/persistence/images/xprt.png",
      "svg": "https://raw.githubusercontent.com/cosmos/chain-registry/master/persistence/images/xprt.svg"
    }
  ]
}