{
  "$schema": "../chain.schema.json",
  "chainName": "impacthub",
  "networkType": "mainnet",
  "website": "https://www.ixo.world/",
  "prettyName": "Impact Hub",
  "chainType": "cosmos",
  "chainId": "ixo-5",
  "bech32Prefix": "ixo",
  "keyAlgos": [
    "secp256k1",
    "ed25519"
  ],
  "slip44": 118,
  "fees": {
    "feeTokens": [
      {
        "denom": "uixo",
        "fixedMinGasPrice": 0.025,
        "lowGasPrice": 0.025,
        "averageGasPrice": 0.025,
        "highGasPrice": 0.04
      }
    ]
  },
  "staking": {
    "stakingTokens": [
      {
        "denom": "uixo"
      }
    ]
  },
  "codebase": {
    "sdk": {
      "type": "cosmos",
      "version": "v0.50.10"
    }
  },
  "apis": {
    "rpc": [
      {
        "address": "https://proxies.sifchain.finance/api/impacthub-3/rpc"
      },
      {
        "address": "https://impacthub.ixo.world/rpc/"
      },
      {
        "address": "https://ixo.rpc.m.stavr.tech:443"
      },
      {
        "address": "https://rpc.lavenderfive.com:443/impacthub"
      },
      {
        "address": "https://ixo.ibs.team/rpc"
      },
      {
        "address": "https://ixo-rpc.bluestake.net:443"
      },
      {
        "address": "https://impacthub_mainnet_rpc.chain.whenmoonwhenlambo.money"
      }
    ],
    "rest": [
      {
        "address": "https://proxies.sifchain.finance/api/impacthub-3/rest"
      },
      {
        "address": "https://impacthub.ixo.world/rest/"
      },
      {
        "address": "https://ixo.api.m.stavr.tech"
      },
      {
        "address": "https://rest.lavenderfive.com:443/impacthub"
      },
      {
        "address": "https://ixo.ibs.team/api"
      },
      {
        "address": "https://ixo-api.bluestake.net"
      },
      {
        "address": "https://impacthub_mainnet_api.chain.whenmoonwhenlambo.money"
      }
    ],
    "grpc": [
      {
        "address": "ixo.grpc.m.stavr.tech:2010"
      },
      {
        "address": "impacthub.lavenderfive.com:443"
      }
    ]
  },
  "explorers": [
    {
      "kind": "staking-explorer.com",
      "url": "https://staking-explorer.com/explorer/impacthub",
      "txPage": "https://staking-explorer.com/transaction.php?chain=impacthub&tx=${txHash}",
      "accountPage": "https://staking-explorer.com/account.php?chain=impacthub&addr=${accountAddress}"
    },
    {
      "kind": "ezstaking",
      "url": "https://ezstaking.app/ixo",
      "txPage": "https://ezstaking.app/ixo/txs/${txHash}",
      "accountPage": "https://ezstaking.app/ixo/account/${accountAddress}"
    },
    {
      "kind": "🔥STAVR🔥",
      "url": "https://explorer.stavr.tech/IXO-Mainnet",
      "txPage": "https://explorer.stavr.tech/IXO-Mainnet/txs/${txHash}",
      "accountPage": "https://explorer.stavr.tech/IXO-Mainnet/account/${accountAddress}"
    },
    {
      "kind": "bigdipper",
      "url": "https://blockscan.ixo.world",
      "txPage": "https://blockscan.ixo.world/transactions/${txHash}"
    },
    {
      "kind": "ping.pub",
      "url": "https://ping.pub/ixo",
      "txPage": "https://ping.pub/ixo/tx/${txHash}"
    },
    {
      "kind": "atomscan",
      "url": "https://atomscan.com/ixo",
      "txPage": "https://atomscan.com/ixo/transactions/${txHash}",
      "accountPage": "https://atomscan.com/ixo/accounts/${accountAddress}"
    },
    {
      "kind": "🚀 WHEN MOON 🌕 WHEN LAMBO 🔥",
      "url": "https://explorer.whenmoonwhenlambo.money/ixo",
      "txPage": "https://explorer.whenmoonwhenlambo.money/ixo/tx/${txHash}",
      "accountPage": "https://explorer.whenmoonwhenlambo.money/ixo/account/${accountAddress}"
    }
  ],
  "images": [
    {
      "png": "https://raw.githubusercontent.com/cosmos/chain-registry/master/impacthub/images/ixo.png",
      "svg": "https://raw.githubusercontent.com/cosmos/chain-registry/master/impacthub/images/ixo.svg"
    }
  ]
}