{
  "$schema": "../../chain.schema.json",
  "chainName": "injectivetestnet",
  "networkType": "testnet",
  "website": "https://injective.com",
  "prettyName": "Injective",
  "chainType": "cosmos",
  "chainId": "injective-888",
  "bech32Prefix": "inj",
  "extraCodecs": [
    "injective"
  ],
  "slip44": 60,
  "fees": {
    "feeTokens": [
      {
        "denom": "inj",
        "fixedMinGasPrice": 160000000,
        "lowGasPrice": 500000000,
        "averageGasPrice": 700000000,
        "highGasPrice": 900000000
      }
    ]
  },
  "staking": {
    "stakingTokens": [
      {
        "denom": "inj"
      }
    ]
  },
  "codebase": {

  },
  "apis": {
    "rpc": [
      {
        "address": "https://injective-testnet-rpc.polkachu.com"
      },
      {
        "address": "https://testnet.sentry.tm.injective.network:443"
      },
      {
        "address": "https://testnet.tm.injective.network"
      },
      {
        "address": "https://injective-testnet-rpc.publicnode.com:443"
      }
    ],
    "rest": [
      {
        "address": "https://injective-testnet-api.polkachu.com"
      },
      {
        "address": "https://testnet.sentry.lcd.injective.network:443"
      },
      {
        "address": "https://testnet.lcd.injective.network"
      },
      {
        "address": "https://injective-testnet-rest.publicnode.com"
      }
    ],
    "grpc": [
      {
        "address": "injective-testnet-grpc.polkachu.com:14390"
      },
      {
        "address": "testnet.sentry.chain.grpc.injective.network:443"
      },
      {
        "address": "https://testnet.grpc.injective.network"
      },
      {
        "address": "injective-testnet-grpc.publicnode.com:443"
      }
    ]
  },
  "explorers": [
    {
      "kind": "injectiveprotocol",
      "url": "https://testnet.explorer.injective.network/",
      "txPage": "https://testnet.explorer.injective.network/transaction/${txHash}"
    }
  ]
}