{
  "$schema": "../chain.schema.json",
  "chainName": "echelon",
  "networkType": "mainnet",
  "prettyName": "Echelon",
  "chainType": "cosmos",
  "chainId": "echelon_3000-3",
  "bech32Prefix": "echelon",
  "slip44": 60,
  "fees": {
    "feeTokens": [
      {
        "denom": "aechelon",
        "lowGasPrice": 10000000000,
        "averageGasPrice": 25000000000,
        "highGasPrice": 40000000000
      }
    ]
  },
  "staking": {
    "stakingTokens": [
      {
        "denom": "aechelon"
      }
    ]
  },
  "codebase": {

  },
  "apis": {
    "rpc": [
      {
        "address": "https://ech01trpc.mindheartsoul.org"
      },
      {
        "address": "https://rpc.echjoker.lol"
      }
    ],
    "rest": [
      {
        "address": "https://ech01api.mindheartsoul.org"
      },
      {
        "address": "https://api.echjoker.lol"
      }
    ],
    "grpc": [

    ],
    "evmHttpJsonrpc": [
      {
        "address": "https://ech01jrpc.mindheartsoul.org"
      },
      {
        "address": "https://jrpc.echjoker.lol"
      }
    ]
  },
  "explorers": [
    {
      "kind": "echelon",
      "url": "https://app.ech.network/explorer",
      "txPage": "https://app.ech.network/explorer/tx/${txHash}"
    },
    {
      "kind": "blockscout",
      "url": "https://scout.ech.network",
      "txPage": "https://scout.ech.network/tx/${txHash}"
    },
    {
      "kind": "ping.pub",
      "url": "https://ping.pub/echelon",
      "txPage": "https://ping.pub/echelon/tx/${txHash}"
    },
    {
      "kind": "atomscan",
      "url": "https://atomscan.com/echelon",
      "txPage": "https://atomscan.com/echelon/transactions/${txHash}",
      "accountPage": "https://atomscan.com/echelon/accounts/${accountAddress}"
    }
  ],
  "images": [
    {
      "png": "https://raw.githubusercontent.com/cosmos/chain-registry/master/echelon/images/logo.png",
      "svg": "https://raw.githubusercontent.com/cosmos/chain-registry/master/echelon/images/echelon.svg"
    }
  ]
}