{
  "$schema": "../chain.schema.json",
  "chainName": "cysic",
  "website": "https://cysic.xyz/",
  "networkType": "mainnet",
  "prettyName": "Cysic",
  "chainType": "cosmos",
  "chainId": "cysicmint_4399-1",
  "bech32Prefix": "cysic",
  "keyAlgos": [
    "ethsecp256k1"
  ],
  "extraCodecs": [
    "ethermint"
  ],
  "slip44": 60,
  "fees": {
    "feeTokens": [
      {
        "denom": "CYS",
        "fixedMinGasPrice": 250000000000,
        "lowGasPrice": 250000000000,
        "averageGasPrice": 250000000000,
        "highGasPrice": 250000000000
      }
    ]
  },
  "staking": {
    "stakingTokens": [
      {
        "denom": "CGT"
      }
    ],
    "lockDuration": {
      "time": "1814400s"
    }
  },
  "codebase": {
    "sdk": {
      "type": "cosmos",
      "repo": "https://github.com/cosmos/cosmos-sdk",
      "version": "v0.46.16"
    }
  },
  "description": "Cysic is an EVM-compatible Layer 1 and full-stack verifiable compute network for zero-knowledge proofs, AI workloads, and decentralized compute markets.",
  "apis": {
    "rpc": [
      {
        "address": "https://rpc.cysic.xyz"
      },
      {
        "address": "https://rpc.cysic.nodestake.org"
      }
    ],
    "rest": [
      {
        "address": "https://rest.cysic.xyz"
      },
      {
        "address": "https://api.cysic.nodestake.org"
      }
    ]
  },
  "explorers": [
    {
      "kind": "Cysic Explorer",
      "url": "https://explorer.cysic.xyz/"
    }
  ],
  "images": [
    {
      "svg": "https://raw.githubusercontent.com/cosmos/chain-registry/master/cysic/images/cysic.svg"
    }
  ]
}