{
  "$schema": "../../chain.schema.json",
  "chainName": "manifesttestnet",
  "networkType": "testnet",
  "website": "https://manifestai.org/",
  "prettyName": "Manifest Testnet",
  "chainId": "manifest-ledger-testnet",
  "chainType": "cosmos",
  "bech32Prefix": "manifest",
  "slip44": 118,
  "fees": {
    "feeTokens": [
      {
        "denom": "umfx",
        "fixedMinGasPrice": 1,
        "lowGasPrice": 1.05,
        "averageGasPrice": 1.1,
        "highGasPrice": 3
      },
      {
        "denom": "factory/manifest1afk9zr2hn2jsac63h4hm60vl9z3e5u69gndzf7c99cqge3vzwjzsfmy9qj/upwr",
        "fixedMinGasPrice": 0.37,
        "lowGasPrice": 0.4,
        "averageGasPrice": 0.5,
        "highGasPrice": 1
      }
    ]
  },
  "staking": {
    "stakingTokens": [
      {
        "denom": "upoa"
      }
    ]
  },
  "codebase": {

  },
  "apis": {
    "rpc": [
      {
        "address": "https://nodes.liftedinit.tech/manifest/testnet/rpc"
      }
    ],
    "rest": [
      {
        "address": "https://nodes.liftedinit.tech/manifest/testnet/api"
      }
    ],
    "grpc": [
      {
        "address": "https://manifest-testnet-grpc.liftedinit.tech"
      }
    ]
  },
  "explorers": [
    {
      "kind": "Default Explorer",
      "url": "https://testnet.manifest.explorers.guru/",
      "txPage": "https://testnet.manifest.explorers.guru/transaction/${txHash}",
      "accountPage": "https://testnet.manifest.explorers.guru/account/${accountAddress}"
    }
  ],
  "images": [
    {
      "imageSync": {
        "chainName": "manifesttestnet"
      },
      "png": "https://raw.githubusercontent.com/cosmos/chain-registry/master/manifest/images/manifest.png",
      "svg": "https://raw.githubusercontent.com/cosmos/chain-registry/master/manifest/images/manifest.svg"
    }
  ]
}