{
  "$schema": "../chain.schema.json",
  "chainName": "aura1",
  "networkType": "mainnet",
  "website": "https://aura.network/",
  "prettyName": "Aura Network",
  "chainType": "cosmos",
  "chainId": "xstaxy-1",
  "bech32Prefix": "aura",
  "keyAlgos": [
    "secp256k1"
  ],
  "slip44": 118,
  "fees": {
    "feeTokens": [
      {
        "denom": "uaura",
        "fixedMinGasPrice": 0.001,
        "lowGasPrice": 0.001,
        "averageGasPrice": 0.002,
        "highGasPrice": 0.0025
      }
    ]
  },
  "staking": {
    "stakingTokens": [
      {
        "denom": "uaura"
      }
    ],
    "lockDuration": {
      "time": "1209600s"
    }
  },
  "codebase": {
    "sdk": {
      "type": "cosmos",
      "version": "0.47.5"
    },
    "cosmwasm": {
      "version": "0.42.0",
      "enabled": true
    }
  },
  "apis": {
    "rpc": [
      {
        "address": "https://rpc.aura.network/"
      },
      {
        "address": "https://m-aura.rpc.utsa.tech"
      },
      {
        "address": "http://aura.rpc.m.stavr.tech:11047"
      },
      {
        "address": "https://aura-rpc.ramuchi.tech"
      },
      {
        "address": "https://aura.rpc.kjnodes.com"
      },
      {
        "address": "https://mainnet-aura-rpc.konsortech.xyz"
      },
      {
        "address": "https://rpc.lavenderfive.com:443/aura"
      },
      {
        "address": "https://aura-rpc.staketab.org:443"
      },
      {
        "address": "https://rpc.aura.safeblock.space"
      },
      {
        "address": "https://rpc.aura.silentvalidator.com"
      },
      {
        "address": "https://rpc-aura.mms.team"
      },
      {
        "address": "https://aura-rpc.stake-town.com"
      },
      {
        "address": "https://aura-rpc.palamar.io"
      },
      {
        "address": "https://aura.rpc.srv.stakr.space"
      },
      {
        "address": "https://aura-rpc.highstakes.ch"
      },
      {
        "address": "https://aura-rpc.noders.services"
      }
    ],
    "rest": [
      {
        "address": "https://lcd.aura.network/"
      },
      {
        "address": "https://m-aura.api.utsa.tech"
      },
      {
        "address": "https://aura.api.m.stavr.tech"
      },
      {
        "address": "https://aura-api.ramuchi.tech"
      },
      {
        "address": "https://aura.api.kjnodes.com"
      },
      {
        "address": "https://mainnet-aura-api.konsortech.xyz"
      },
      {
        "address": "https://rest.lavenderfive.com:443/aura"
      },
      {
        "address": "https://aura-rest.staketab.org"
      },
      {
        "address": "https://api.aura.safeblock.space"
      },
      {
        "address": "https://api.aura.silentvalidator.com"
      },
      {
        "address": "https://api-aura.mms.team"
      },
      {
        "address": "https://aura-api.stake-town.com"
      },
      {
        "address": "https://aura-api.palamar.io"
      },
      {
        "address": "https://aura.api.srv.stakr.space"
      },
      {
        "address": "https://aura-api.highstakes.ch"
      },
      {
        "address": "https://aura-api.noders.services"
      }
    ],
    "grpc": [
      {
        "address": "https://grpc.aura.network"
      },
      {
        "address": "auranetwork-mainnet-grpc.autostake.com:443"
      },
      {
        "address": "https://aura-grpc.ramuchi.tech:15000"
      },
      {
        "address": "http://aura.grpc.m.stavr.tech:9901"
      },
      {
        "address": "aura.grpc.kjnodes.com:11790"
      },
      {
        "address": "aura.lavenderfive.com:443"
      },
      {
        "address": "services.staketab.com:9021"
      },
      {
        "address": "grpc.aura.silentvalidator.com:443"
      },
      {
        "address": "grpc-aura.mms.team:443"
      },
      {
        "address": "aura-grpc.stake-town.com:443"
      },
      {
        "address": "grpc.aura.safeblock.space:9090"
      },
      {
        "address": "aura-grpc.palamar.io:443"
      },
      {
        "address": "aura.grpc.srv.stakr.space:19090"
      },
      {
        "address": "aura-grpc.noders.services:17090"
      }
    ]
  },
  "explorers": [
    {
      "kind": "aurascan",
      "url": "https://aurascan.io",
      "txPage": "https://aurascan.io/transaction/${txHash}",
      "accountPage": "https://aurascan.io/account/${accountAddress}"
    },
    {
      "kind": "𝐥𝐞𝐬𝐧𝐢𝐤 | 𝐔𝐓𝐒𝐀 Explorer",
      "url": "https://exp.utsa.tech/aura",
      "txPage": "https://exp.utsa.tech/aura/tx/${txHash}",
      "accountPage": "https://exp.utsa.tech/aura/account/${accountAddress}"
    },
    {
      "kind": "🔥STAVR🔥 Explorer",
      "url": "https://explorer.stavr.tech/Aura-Mainnet",
      "txPage": "https://explorer.stavr.tech/aura-mainnet/tx/${txHash}",
      "accountPage": "https://explorer.stavr.tech/aura-mainnet/account/${accountAddress}"
    },
    {
      "kind": "NodeStake Explorer",
      "url": "https://explorer.nodestake.org/aura",
      "txPage": "https://explorer.nodestake.org/aura/tx/${txHash}",
      "accountPage": "https://explorer.nodestake.org/aura/account/${accountAddress}"
    },
    {
      "kind": "TC Network",
      "url": "https://explorer.tcnetwork.io/aura",
      "txPage": "https://explorer.tcnetwork.io/aura/transaction/${txHash}",
      "accountPage": "https://explorer.tcnetwork.io/aura/account/${accountAddress}"
    },
    {
      "kind": "Stake-Take",
      "url": "https://explorer.stake-take.com/aura",
      "txPage": "https://explorer.stake-take.com/aura/tx/${txHash}",
      "accountPage": "https://explorer.stake-take.com/aura/account/${accountAddress}"
    },
    {
      "kind": "Safe Block",
      "url": "https://explorer.safeblock.space/aura",
      "txPage": "https://explorer.safeblock.space/aura/tx/${txHash}",
      "accountPage": "https://explorer.safeblock.space/aura/account/${accountAddress}"
    },
    {
      "kind": "STAKR.space explorer",
      "url": "https://explorer.stakr.space/aura/",
      "txPage": "https://explorer.stakr.space/aura/tx/${txHash}",
      "accountPage": "https://explorer.stakr.space/aura/account/${accountAddress}"
    }
  ],
  "images": [
    {
      "imageSync": {
        "chainName": "aura"
      },
      "png": "https://raw.githubusercontent.com/cosmos/chain-registry/master/aura/images/Aura-logo-2.2.png",
      "svg": "https://raw.githubusercontent.com/cosmos/chain-registry/master/aura/images/Aura-logo-2.2.svg"
    }
  ]
}